{
  "contextVersion": "0.2.0",
  "generatedAt": "2026-07-15T00:12:53.256Z",
  "sources": {
    "workspace": "workspace.json",
    "wir": "wir.json",
    "graph": "wir.graph.json"
  },
  "workspace": {
    "name": "test-workspace-example",
    "version": "0.1.0",
    "description": "",
    "languages": []
  },
  "architecture": {
    "style": "Monolithic Codebase",
    "patterns": [
      "Documentation-driven Design"
    ],
    "modules": [
      {
        "path": "README.md",
        "size": 1349
      },
      {
        "path": "artifacts/sample.md",
        "size": 117
      },
      {
        "path": "wir.graph.json",
        "size": 1978
      },
      {
        "path": "wir.json",
        "size": 2707
      },
      {
        "path": "workspace.json",
        "size": 136
      }
    ],
    "layers": [
      "Documentation",
      "Portal Assets"
    ],
    "dependencies": {
      "internal": [],
      "external": []
    }
  },
  "graph": {
    "summary": {},
    "nodes": [
      {
        "id": "workspace:test-workspace",
        "type": "workspace",
        "label": "test-workspace-example",
        "metadata": {
          "version": "0.1.0"
        }
      },
      {
        "id": "file:README.md",
        "type": "file",
        "label": "README.md",
        "metadata": {
          "path": "README.md"
        }
      },
      {
        "id": "dir:artifacts",
        "type": "directory",
        "label": "artifacts",
        "metadata": {
          "path": "artifacts"
        }
      },
      {
        "id": "file:artifacts/sample.md",
        "type": "file",
        "label": "sample.md",
        "metadata": {
          "path": "artifacts/sample.md"
        }
      },
      {
        "id": "file:wir.graph.json",
        "type": "file",
        "label": "wir.graph.json",
        "metadata": {
          "path": "wir.graph.json"
        }
      },
      {
        "id": "file:wir.json",
        "type": "file",
        "label": "wir.json",
        "metadata": {
          "path": "wir.json"
        }
      },
      {
        "id": "file:workspace.json",
        "type": "file",
        "label": "workspace.json",
        "metadata": {
          "path": "workspace.json"
        }
      }
    ],
    "edges": [
      {
        "from": "workspace:test-workspace",
        "to": "file:README.md",
        "type": "contains",
        "metadata": {}
      },
      {
        "from": "workspace:test-workspace",
        "to": "dir:artifacts",
        "type": "contains",
        "metadata": {}
      },
      {
        "from": "dir:artifacts",
        "to": "file:artifacts/sample.md",
        "type": "contains",
        "metadata": {}
      },
      {
        "from": "workspace:test-workspace",
        "to": "file:wir.graph.json",
        "type": "contains",
        "metadata": {}
      },
      {
        "from": "workspace:test-workspace",
        "to": "file:wir.json",
        "type": "contains",
        "metadata": {}
      },
      {
        "from": "workspace:test-workspace",
        "to": "file:workspace.json",
        "type": "contains",
        "metadata": {}
      }
    ]
  },
  "quality": {
    "lintSummary": {},
    "issues": []
  },
  "constraints": {},
  "metadata": {},
  "_truncated": false
}